{
  "$schema": "./exchange-online-secure-baseline.schema.json",
  "metadata": {
    "name": "Microsoft-native Exchange Online secure baseline",
    "version": "2.0.0",
    "reviewedOn": "2026-09-16",
    "deploymentProfile": "MicrosoftNative",
    "profile": "Microsoft recommended Standard plus Strict for priority users, no third-party SMTP gateway",
    "configurationOwner": "__ADMIN_REQUIRED:CONFIGURATION_OWNER_UPN__"
  },
  "licensing": {
    "messagingTier": "MDO_P1",
    "complianceTier": "E3",
    "requiredServicePlans": [
      {
        "servicePlanId": "efb87545-963c-4e0d-99df-69c6916d9eb0",
        "servicePlanName": "EXCHANGE_S_ENTERPRISE",
        "controls": ["EXO-001", "EXO-002", "EXO-004", "EXO-005", "EXO-006", "EXO-007", "EXO-008", "EXO-009"]
      },
      {
        "servicePlanId": "f20fedf3-f3c3-43c3-8267-2bfdd51c0939",
        "servicePlanName": "ATP_ENTERPRISE",
        "controls": ["MDO-001", "MDO-002", "MDO-003", "MDO-004"]
      },
      {
        "servicePlanId": "bf6f5520-59e3-4f82-974b-7dbbc4fd27c7",
        "servicePlanName": "SAFEDOCS",
        "controls": ["MDO-005"]
      },
      {
        "servicePlanId": "2f442157-a11c-46b9-ae5b-6e39ff4e5849",
        "servicePlanName": "M365_ADVANCED_AUDITING",
        "controls": ["GOV-001"]
      }
    ],
    "targetValidationMode": "TenantAndEveryTarget",
    "servicePlanProvisioningStateBehavior": {
      "disabled": "TreatAsNotEntitled",
      "suspended": "TreatAsNotEntitled",
      "pending": "TreatAsNotEntitled"
    },
    "notes": "The tiers are planning metadata. Entitlement is decided from the tenant service-plan inventory, and a plan that is assigned but not enabled is never entitled. Verify every servicePlanId against the Microsoft published product names and service plan identifiers list. See docs/LICENSING-GATE.md."
  },
  "administratorInputs": {
    "tenantId": "__ADMIN_REQUIRED:MICROSOFT_ENTRA_TENANT_GUID__",
    "organizationName": "__ADMIN_REQUIRED:LEGAL_ORGANIZATION_NAME__",
    "primaryDomain": "__ADMIN_REQUIRED:PRIMARY_SMTP_DOMAIN__",
    "initialDomain": "__ADMIN_REQUIRED:INITIAL_ONMICROSOFT_DOMAIN__",
    "securityOperationsMailbox": "__ADMIN_REQUIRED:SECURITY_OPERATIONS_MAILBOX__",
    "priorityUsersGroup": "__ADMIN_REQUIRED:MAIL_ENABLED_PRIORITY_USERS_GROUP__",
    "siemPlatform": "__ADMIN_REQUIRED:CENTRAL_SIEM_PLATFORM__",
    "changeRecord": "__ADMIN_REQUIRED:APPROVED_CHANGE_RECORD__"
  },
  "desiredState": {
    "acceptedDomain": {
      "domainName": "__ADMIN_REQUIRED:PRIMARY_SMTP_DOMAIN__",
      "domainType": "Authoritative"
    },
    "mailFlow": {
      "gateway": {
        "declared": false,
        "vendor": "None",
        "direction": "None"
      },
      "mxTarget": "__ADMIN_REQUIRED:MICROSOFT_365_MX_TARGET__",
      "inboundPath": "Internet -> Exchange Online Protection -> Exchange Online",
      "outboundPath": "Exchange Online -> Internet",
      "enhancedFiltering": {
        "enabled": false,
        "skipLastIp": false,
        "skipIpAddresses": [],
        "applyToAllRecipients": false
      },
      "prohibitedBypass": {
        "sclMinusOneTransportRules": false,
        "directToTenantMxFromInternet": false,
        "ipAllowListForProofpoint": false
      }
    },
    "defenderForOffice365": {
      "standardPreset": {
        "enabled": true,
        "scope": "AllRecipientsExceptStrictAndSecOps",
        "sentToDomains": [
          "__ADMIN_REQUIRED:PRIMARY_SMTP_DOMAIN__"
        ],
        "excludedGroups": [
          "__ADMIN_REQUIRED:MAIL_ENABLED_PRIORITY_USERS_GROUP__"
        ],
        "excludedSecOpsMailbox": [
          "__ADMIN_REQUIRED:SECURITY_OPERATIONS_MAILBOX__"
        ]
      },
      "strictPreset": {
        "enabled": true,
        "scopeGroup": "__ADMIN_REQUIRED:MAIL_ENABLED_PRIORITY_USERS_GROUP__"
      },
      "builtInProtection": {
        "enabled": true,
        "exceptions": []
      },
      "impersonationProtection": {
        "enabled": true,
        "protectedUsers": [
          "__ADMIN_REQUIRED:IMPERSONATION_PROTECTED_USER_SMTP_ADDRESSES__"
        ],
        "protectedDomains": [
          "__ADMIN_REQUIRED:IMPERSONATION_PROTECTED_CUSTOM_DOMAINS__"
        ],
        "approvedExceptions": []
      },
      "safeAttachmentsForSharePointOneDriveTeams": true,
      "safeDocuments": {
        "enabled": true,
        "allowBypass": false,
        "requiredServicePlan": "SAFEDOCS",
        "licenseRequired": "Microsoft 365 E5/A5/G5 or Microsoft Defender Suite"
      },
      "zeroHourAutoPurge": true,
      "quarantinePolicies": {
        "endUserAccessLevel": "LimitedAccess",
        "highRiskAccessLevel": "AdminOnlyAccess",
        "highRiskCategories": ["Malware", "HighConfidencePhish"],
        "endUserSpamNotificationFrequencyInDays": 1,
        "includeMessagesFromBlockedSenderAddress": false,
        "categoryPermissions": [
          { "category": "Malware", "accessLevel": "AdminOnlyAccess" },
          { "category": "HighConfidencePhish", "accessLevel": "AdminOnlyAccess" },
          { "category": "Phish", "accessLevel": "LimitedAccess" },
          { "category": "HighConfidenceSpam", "accessLevel": "LimitedAccess" },
          { "category": "Spam", "accessLevel": "LimitedAccess" },
          { "category": "Bulk", "accessLevel": "LimitedAccess" },
          { "category": "SpoofIntelligence", "accessLevel": "LimitedAccess" }
        ]
      },
      "userSubmissions": {
        "microsoftReportMessageButton": true,
        "sendReportedMessagesToMicrosoft": true,
        "sendCopyToSecOpsMailbox": true,
        "reportingDestination": "MicrosoftAndCustomMailbox",
        "reportingMailbox": "__ADMIN_REQUIRED:SECURITY_OPERATIONS_MAILBOX__"
      },
      "advancedDelivery": {
        "secOpsMailbox": [
          "__ADMIN_REQUIRED:SECURITY_OPERATIONS_MAILBOX__"
        ],
        "phishingSimulationOverrides": []
      },
      "tenantAllowBlockList": {
        "registerLocation": "__ADMIN_REQUIRED:TENANT_ALLOW_BLOCK_LIST_REGISTER_LOCATION__",
        "permanentAllowEntries": [],
        "blockEntriesRequireExpiryAndTicket": true,
        "allowEntryMaximumDurationDays": 30,
        "blockEntryRetentionDays": 90,
        "requiredEntryFields": [
          "entryType",
          "entryValue",
          "owner",
          "ticket",
          "createdDateTime",
          "expirationDateTime",
          "justification"
        ]
      }
    },
    "exchangeOnline": {
      "smtpClientAuthenticationDisabled": true,
      "externalPostmasterAddress": "__ADMIN_REQUIRED:EXTERNAL_POSTMASTER_SMTP_ADDRESS__",
      "mailboxAuditingDefault": true,
      "mailboxAuditBypassAssociations": [],
      "modernAuthenticationRequired": true,
      "legacyAuthenticationBlockedByConditionalAccess": true,
      "automaticExternalForwarding": "Off",
      "remoteDomainAutoForwardEnabled": false,
      "externalSenderIdentification": {
        "enabled": true,
        "allowList": []
      },
      "remoteDomainDefault": {
        "autoForwardEnabled": false,
        "autoReplyEnabled": false,
        "allowedOOFType": "None",
        "deliveryReportEnabled": false,
        "nonDeliveryReportEnabled": false
      },
      "protocolRestriction": {
        "ewsEnabled": false,
        "ewsAllowList": [],
        "popEnabledByDefault": false,
        "imapEnabledByDefault": false,
        "outlookAddInsForUsers": false
      },
      "roleBasedAccessControl": {
        "noStandingGlobalAdministratorForMessaging": true,
        "privilegedRolesJustInTime": true,
        "roleGroupReviewFrequencyDays": 90,
        "approvedRoleGroups": [
          "Organization Management",
          "Security Administrator",
          "Security Reader",
          "View-Only Organization Management"
        ]
      },
      "transportSecurity": {
        "mtaStsMode": "enforce",
        "mtaStsMaxAgeSeconds": 604800,
        "tlsRptEnabled": true,
        "tlsRptAddress": "__ADMIN_REQUIRED:TLS_RPT_REPORTING_ADDRESS__"
      }
    },
    "emailAuthentication": {
      "dkim": {
        "enabled": true,
        "keySize": 2048,
        "selector1Cname": "__ADMIN_REQUIRED:VALUE_RETURNED_BY_GET_DKIMSIGNINGCONFIG__",
        "selector2Cname": "__ADMIN_REQUIRED:VALUE_RETURNED_BY_GET_DKIMSIGNINGCONFIG__"
      },
      "spf": {
        "record": "v=spf1 include:spf.protection.outlook.com -all",
        "hardFail": true,
        "singleRecordOnly": true
      },
      "dmarc": {
        "policy": "reject",
        "percentage": 100,
        "aggregateReportAddress": "__ADMIN_REQUIRED:DMARC_AGGREGATE_REPORTING_ADDRESS__",
        "forensicReportAddress": "__ADMIN_REQUIRED:DMARC_FORENSIC_REPORTING_ADDRESS_OR_NOT_APPLICABLE__",
        "subdomainPolicy": "reject",
        "dkimAlignment": "relaxed",
        "spfAlignment": "relaxed"
      },
      "trustedArcSealers": []
    },
    "centralMonitoring": {
      "defenderXdrIncidentQueue": true,
      "unifiedAuditLog": true,
      "exchangeAdminAudit": true,
      "messageTrace": true,
      "mailFlowReports": true,
      "threatProtectionStatusReport": true,
      "siemIntegration": {
        "enabled": true,
        "destination": "__ADMIN_REQUIRED:CENTRAL_SIEM_PLATFORM__",
        "sources": [
          "Microsoft Defender XDR incidents and alerts",
          "Office 365 audit logs",
          "Exchange admin audit events",
          "Microsoft Entra sign-in and audit logs",
          "Microsoft Defender for Office 365 email events",
          "Microsoft Purview alerts and DLP events"
        ],
        "minimumRetentionDays": 180,
        "alertRecipients": [
          "__ADMIN_REQUIRED:SECURITY_OPERATIONS_MAILBOX__"
        ],
        "maximumConnectorAgeMinutes": 60,
        "maximumSyntheticAlertAgeMinutes": 60,
        "requireSignedEvidence": true,
        "requireCompleteCollection": true
      },
      "unifiedAudit": {
        "enabled": true,
        "minimumRetentionDays": 180,
        "maximumEvidenceAgeHours": 24,